{
  "$schema": "../schema/package.schema.json",
  "id": "ioniq5-preconditioning-uninstall",
  "name": "Ioniq 5 Preconditioning (Uninstall)",
  "description": "An app that gives you a manual preconditioning button in your IONIQ 5. For uninstalling via the Nemesis Package Manager.",
  "version": "0.1.0",
  "format": "zip",
  "core": false,
  "url": "https://github.com/paytondevs/ioniq5-preconditioning/releases/download/0.1-beta/Launchpad-uninstall-usb.zip",
  "sha256": "7cac8dcb2c5e6896bf2a02e64d29629ed96c314fb8a72a7627de9e2f899c57b9",
  "size": 3589,
  "extract": true,
  "slot": "packages",
  "profiles": ["nemesis"],
  "requires": ["nemesis-core"],
  "homepage": "https://github.com/paytondevs/ioniq5-preconditioning"
}
