{
  "$schema": "../schema/package.schema.json",
  "id": "gen5-codec-patch",
  "name": "Gen5 Codec Patch",
  "description": "A NEMESIS package for Hyundai/Kia/Genesis Gen5W head units (Android 4.4.2, Telechips TCC803x). It makes video work in third-party players such as SmartTube, Kodi, or anything built on ExoPlayer, instead of having them fail.",
  "version": "2.0.2",
  "format": "zip",
  "core": false,
  "url": "https://github.com/KramerTech/gen5-codec-patch/releases/download/v2.0.2/media-codecs-2.0.2-usb.zip",
  "sha256": "1f661e52b65b6f4b7b8bccb7507892f5d4e2bf3ffe2a79d67b62256af08a01d1",
  "size": 335563,
  "extract": true,
  "slot": "packages",
  "profiles": ["nemesis"],
  "requires": ["nemesis-core"],
  "homepage": "https://github.com/KramerTech/gen5-codec-patch"
}
