{
  "$schema": "../schema/package.schema.json",
  "id": "keybord",
  "name": "KeyBORD",
  "description": "USB-ready keyboard installation, activation, and restoration tools for Hyundai Gen5W infotainment systems using NEMESIS..",
  "version": "1.0.0",
  "format": "zip",
  "core": false,
  "url": "https://github.com/ntwm787/KeyBORD-Gen5W/releases/download/v1.0.0/Hacker.Keyboard.USB.v1.zip",
  "sha256": "ed98a90707e69335bf988f30c69549d847f99ef116cbd1dfefc6467fb923710f",
  "size": 2016884,
  "extract": true,
  "slot": "packages",
  "profiles": ["nemesis"],
  "requires": ["nemesis-core"],
  "homepage": "https://github.com/ntwm787/KeyBORD-Gen5W"
}
